{
  "$schema": "./schemas/external-tools-lock.schema.json",
  "schemaVersion": 1,
  "common": [
    {
      "name": "git",
      "version": "2.54.0.windows.1",
      "required": true
    },
    {
      "name": "python",
      "minimumVersion": "3.8",
      "requiredFor": ["trace renderer", "patch scripts"]
    },
    {
      "name": "uv",
      "version": "0.9.27",
      "requiredFor": ["serena-agent"]
    }
  ],
  "mcp": [
    {
      "package": "@brave/brave-search-mcp-server",
      "version": "2.0.85",
      "command": "brave-search-mcp-server",
      "optional": true,
      "probe": "npm-package-version"
    },
    {
      "package": "mcp-server-fetch",
      "version": "2025.4.7",
      "command": "mcp-server-fetch",
      "optional": true,
      "probe": "command-present"
    }
  ],
  "codeProfile": [
    {
      "package": "@ast-grep/cli",
      "version": "0.45.3",
      "command": "ast-grep.exe",
      "probe": "direct-version",
      "probeArguments": ["--version"],
      "windowsSpawnFix": "stage-real-executable"
    },
    {
      "package": "codebase-memory-mcp",
      "version": "0.11.0",
      "command": "codebase-memory-mcp.exe",
      "probe": "npm-root-executable-version",
      "probeArguments": ["--version"],
      "npmExecutableRelativePath": "codebase-memory-mcp/bin/codebase-memory-mcp.exe"
    },
    {
      "package": "serena-agent",
      "version": "1.7.0",
      "pythonVersion": "3.12.10",
      "command": "serena",
      "installer": "uv tool",
      "probe": "direct-version",
      "probeArguments": ["--version"]
    }
  ]
}
